{"$schema":"https://json-schema.org/draft/2020-12/schema","$id":"https://anomaly.local/gmcp-contract/1.1.0/Anomaly.Shop.List.json","title":"Anomaly.Shop.List","description":"Room-bound snapshot (module Anomaly.Shop) while the character stands in a shop room: every slot with this character's price, current stock and maximum, the restock clock, and whether this character can use the item now. Re-sent when any of it changes, usability included. Cleared by Session.Reset scope room, which a subscriber of Anomaly.Shop receives on every room change even without Anomaly.Room or Anomaly.Mob. Requested outside a shop room, or sent on entering a room that is not a shop, it is {room, shop:null, name:null, items:[]}.","x-direction":"s2c","x-frozen":false,"x-since":"1.1.0","type":"object","properties":{"room":{"type":"string","pattern":"^[0-9]+,[0-9]+$"},"shop":{"type":["integer","null"]},"name":{"type":["string","null"]},"items":{"type":"array","items":{"type":"object","properties":{"num":{"type":"integer"},"name":{"type":"string"},"price":{"type":"object","properties":{"amount":{"type":"integer","minimum":0},"currency":{"enum":["copper","silver","gold","platinum","runic"]}},"required":["amount","currency"],"additionalProperties":false},"stock":{"type":"integer","minimum":0},"max":{"type":"integer","minimum":0},"restockMinutes":{"type":["integer","null"]},"canUse":{"type":"boolean","description":"the receiving character, now, by the engine's own check; live, never cached past the next snapshot"},"cannotUseBecause":{"type":"array","items":{"enum":["level","class","race","weaponType","armourType","magical","alignment"]},"maxItems":1,"description":"why the engine's own use check (ItemUsability.CanUse) refuses it, in the order it checks: level (below the minimum or above the maximum), class (the class list), race (the race list), weaponType (the class's weapon type), armourType (armour heavier than the class allows), magical (a Magical item and an anti-magic class), alignment (Good/Evil/Neutral-only, the evil-point minimum, Not-Good, Not-Evil). The engine stops at the first refusal, so this holds one reason; empty when canUse is true"}},"required":["num","name","price","stock","max","restockMinutes","canUse","cannotUseBecause"],"additionalProperties":false}}},"required":["room","shop","name","items"],"additionalProperties":false,"allOf":[{"if":{"properties":{"shop":{"type":"null"}}},"then":{"properties":{"name":{"type":"null"},"items":{"maxItems":0}}}}]}
