{"room":"1,306","shop":6,"name":"Armour Shop, Torso/Legs","items":[{"num":14,"name":"chainmail hauberk","price":{"amount":80,"currency":"gold"},"stock":25,"max":25,"restockMinutes":180,"canUse":true,"cannotUseBecause":[]},{"num":100542,"name":"hunter's iron cuff","price":{"amount":160,"currency":"gold"},"stock":10,"max":10,"restockMinutes":240,"canUse":false,"cannotUseBecause":["class"]}]}
